{
  "schema_version": "bootstrap-authority-pack.v1",
  "contract_id": "bootstrap.aws.admin-v2",
  "provider": "aws",
  "status": "frozen_offline_contract",
  "validation_level": "offline_pre_e2e",
  "requires_supervised_live_validation": true,
  "target_modes": ["account"],
  "scope_summary": "One selected AWS account; creates or reconciles one prefixed IAM deployment user, one customer-managed thesis-demo-v2 policy, their attachment, and one access key.",
  "permission_groups": [
    {
      "id": "identity_validation",
      "scope": "Caller and selected account",
      "permissions": ["sts:GetCallerIdentity", "iam:GetUser"]
    },
    {
      "id": "generated_identity",
      "scope": "IAM users named twin2mc-* in the selected account",
      "permissions": ["iam:CreateUser", "iam:DeleteUser", "iam:GetUser", "iam:TagUser", "iam:UntagUser"]
    },
    {
      "id": "deployment_policy",
      "scope": "Customer-managed policies named twin2mc-* and their attachment only to the generated twin2mc-* user",
      "permissions": ["iam:CreatePolicy", "iam:DeletePolicy", "iam:GetPolicy", "iam:GetPolicyVersion", "iam:ListPolicyVersions", "iam:CreatePolicyVersion", "iam:DeletePolicyVersion", "iam:AttachUserPolicy", "iam:DetachUserPolicy", "iam:ListAttachedUserPolicies", "iam:ListEntitiesForPolicy", "iam:TagPolicy", "iam:UntagPolicy"]
    },
    {
      "id": "generated_and_bootstrap_keys",
      "scope": "Generated user access key and the exact dedicated submitted key when its owner can be proven",
      "permissions": ["iam:CreateAccessKey", "iam:DeleteAccessKey", "iam:GetAccessKeyLastUsed", "iam:ListAccessKeys"]
    }
  ],
  "credential_cleanup": [
    "Detach the exact gate-owned customer-managed policy, delete every non-default policy version, and delete the policy before deleting the generated user.",
    "Delete only the exact submitted access-key ID after proving its IAM user owner.",
    "Record STS provider expiry instead of claiming early revocation.",
    "Return manual_revocation_required when ownership or delete authority cannot be proven."
  ],
  "limitations": [
    "AWS root access keys are forbidden.",
    "The historical admin-v1 inline-policy path cannot carry thesis-demo-v2 because an IAM user has a 2,048-character aggregate inline-policy quota; v2 therefore uses one customer-managed policy whose document must remain below 6,144 characters.",
    "IAM create operations and caller discovery cannot be fully resource-scoped before the generated ARN exists.",
    "The pack is offline evidence and requires IAM Access Analyzer plus a separately approved live validation."
  ],
  "sources": [
    "https://docs.aws.amazon.com/IAM/latest/UserGuide/reference_iam-quotas.html",
    "https://docs.aws.amazon.com/IAM/latest/UserGuide/access_policies_managed-vs-inline.html",
    "https://docs.aws.amazon.com/IAM/latest/UserGuide/access_controlling.html",
    "https://docs.aws.amazon.com/IAM/latest/APIReference/API_DeletePolicy.html",
    "https://docs.aws.amazon.com/service-authorization/latest/reference/list_identityandaccessmanagementiam.html"
  ]
}
