{
  "schema_version": "bootstrap-authority-pack.v1",
  "contract_id": "bootstrap.aws.admin-v1",
  "provider": "aws",
  "status": "frozen_offline_contract",
  "validation_level": "offline_pre_e2e",
  "requires_supervised_live_validation": true,
  "target_modes": ["account"],
  "scope_summary": "One selected AWS account; creates or reconciles one prefixed IAM deployment user, its inline thesis-demo-v2 policy, and one access key.",
  "permission_groups": [
    {
      "id": "identity_validation",
      "scope": "Caller and selected account",
      "permissions": ["sts:GetCallerIdentity", "iam:GetUser"]
    },
    {
      "id": "generated_identity",
      "scope": "IAM users named twin2mc-* in the selected account",
      "permissions": ["iam:CreateUser", "iam:DeleteUser", "iam:GetUser", "iam:TagUser", "iam:UntagUser"]
    },
    {
      "id": "deployment_policy",
      "scope": "Inline thesis-demo-v2 policy on the generated twin2mc-* user",
      "permissions": ["iam:PutUserPolicy", "iam:GetUserPolicy", "iam:DeleteUserPolicy", "iam:ListUserPolicies"]
    },
    {
      "id": "generated_and_bootstrap_keys",
      "scope": "Generated user access key and the exact dedicated submitted key when its owner can be proven",
      "permissions": ["iam:CreateAccessKey", "iam:DeleteAccessKey", "iam:GetAccessKeyLastUsed", "iam:ListAccessKeys"]
    }
  ],
  "credential_cleanup": [
    "Delete only the exact submitted access-key ID after proving its IAM user owner.",
    "Record STS provider expiry instead of claiming early revocation.",
    "Return manual_revocation_required when ownership or delete authority cannot be proven."
  ],
  "limitations": [
    "AWS root access keys are forbidden.",
    "IAM create operations and caller discovery cannot be fully resource-scoped before the generated ARN exists.",
    "The pack is offline evidence and requires IAM Access Analyzer plus a separately approved live validation."
  ],
  "sources": [
    "https://docs.aws.amazon.com/IAM/latest/APIReference/API_CreateAccessKey.html",
    "https://docs.aws.amazon.com/service-authorization/latest/reference/list_identityandaccessmanagementiam.html"
  ]
}
