{
  "schema_version": "bootstrap-authority-pack.v1",
  "contract_id": "bootstrap.azure.admin-v2",
  "provider": "azure",
  "status": "frozen_offline_contract",
  "validation_level": "offline_pre_e2e",
  "requires_supervised_live_validation": true,
  "target_modes": ["subscription"],
  "scope_summary": "One Entra tenant and selected Azure subscription; creates or reconciles one prefixed application/service principal, one client secret, the reviewed thesis-demo-v2 custom role definition, and its subscription assignment.",
  "permission_groups": [
    {
      "id": "directory_identity",
      "scope": "Selected Entra tenant",
      "permissions": ["Application.ReadWrite.All"]
    },
    {
      "id": "subscription_validation",
      "scope": "Selected Azure subscription",
      "permissions": ["Microsoft.Resources/subscriptions/read", "Microsoft.Authorization/roleDefinitions/read"]
    },
    {
      "id": "deployment_role_definition",
      "scope": "The selected subscription as the sole assignable scope of the generated thesis-demo-v2 custom role",
      "permissions": ["Microsoft.Authorization/roleDefinitions/write", "Microsoft.Authorization/roleDefinitions/delete"]
    },
    {
      "id": "deployment_assignment",
      "scope": "Selected subscription and generated twin2mc-* service principal",
      "permissions": ["Microsoft.Authorization/roleAssignments/read", "Microsoft.Authorization/roleAssignments/write", "Microsoft.Authorization/roleAssignments/delete"]
    }
  ],
  "credential_cleanup": [
    "Remove only the submitted client-secret key ID from the bootstrap application when Graph authority and ownership are proven.",
    "Never delete or alter an existing_user_owned application credential.",
    "Return manual_revocation_required when the safe key ID or Graph delete authority is unavailable."
  ],
  "limitations": [
    "Azure subscription Owner alone does not prove Entra application authority.",
    "Application.ReadWrite.All is directory-wide and therefore a documented PoC bootstrap boundary, not formal least privilege.",
    "Role-definition write/delete is privileged at the selected subscription; adapter ownership checks and a deterministic twin2mc-e2e-* role ID are mandatory before update or cleanup.",
    "The exact custom-role, Graph, assignment, and cleanup behavior requires the separately approved setup-only live identity gate."
  ],
  "sources": [
    "https://learn.microsoft.com/en-us/azure/role-based-access-control/custom-roles",
    "https://learn.microsoft.com/en-us/azure/role-based-access-control/role-definitions",
    "https://learn.microsoft.com/en-us/graph/api/application-post-applications?view=graph-rest-1.0",
    "https://learn.microsoft.com/en-us/graph/api/application-addpassword?view=graph-rest-1.0",
    "https://learn.microsoft.com/en-us/graph/api/serviceprincipal-post-serviceprincipals?view=graph-rest-1.0"
  ]
}
